name,price,seller,reviews,stars
zapatilla deportiva de niños NIKE TANJUN negro blanco.,"34,99 €", en más de 5 tiendas,(271),4.7 de 5 estrellas
zapatilllas MARCHA ACTIVA de hombre nike Tanjun negro / blanco,"44,99 €", en más de 5 tiendas,(1.540),4.7 de 5 estrellas
Nike Air VaporMax Chukka Slip Zapatillas - Hombre - Negro,"220,00 €", de Nike Oficial,(1),5 de 5 estrellas
Nike Zoom Train Complete Zapatillas de entrenamiento - Hombre - Rojo,"65,97 €", en 2 tiendas,(20),4.9 de 5 estrellas
Nike Free RN 2017 Zapatillas de running - Hombre - Gris,"76,97 €", en más de 5 tiendas,(240),4.5 de 5 estrellas
Nike Air Max Fury Zapatillas de running - Hombre - Caqui,"76,97 €", en 4 tiendas,(19),3.7 de 5 estrellas
Nike Air VaporMax Zapatillas de running - Hombre - Azul,"190,00 €", en 3 tiendas,(226),4 de 5 estrellas
Nike Flex Trainer 7 Zapatillas de entrenamiento - Mujer - Negro,"70,00 €", en 3 tiendas,(86),4.6 de 5 estrellas
Nike Studio Wrap 4 Zapatillas de entrenamiento - Mujer - Negro,"41,97 €", en 2 tiendas,(40),3.8 de 5 estrellas
Nike Air Zoom Pegasus 34 Zapatillas de running - Mujer - Negro,"83,97 €", en 2 tiendas,(156),4.6 de 5 estrellas
Nike SB Portmore II Ultralight Zapatillas de skateboard - Hombre ...,"41,97 €", en 2 tiendas,(23),3.8 de 5 estrellas
Nike Air Max 2017 Zapatillas de running - Hombre - Negro,"190,00 €", en 3 tiendas,(174),4.3 de 5 estrellas
Nike SB Check Solarsoft Zapatillas de skateboard - Hombre - Negro,"60,00 €", en 2 tiendas,(263),4.6 de 5 estrellas
Nike SB Delta Force Vulc Zapatillas de skateboard - Hombre - Blanco,"55,00 €", de Nike Oficial,(25),4.1 de 5 estrellas
Nike Internationalist SE Zapatillas - Hombre - Oliva,"90,00 €", en 4 tiendas,0,0
Nike MD Runner 2 Zapatillas - Hombre - Azul,"65,00 €", en más de 5 tiendas,(276),4.5 de 5 estrellas
Nike Air Zoom Vomero 13 Zapatillas de running - Hombre - Azul,"140,00 €", en más de 5 tiendas,(3),5 de 5 estrellas
Nike Air Max 2017 Zapatillas de running - Mujer - Negro,"190,00 €", en 2 tiendas,(39),4.3 de 5 estrellas
Nike Court Royale Zapatillas - Hombre - Blanco,"55,00 €", en 4 tiendas,(126),4.7 de 5 estrellas
Nike Flight Bonafide Zapatillas - Hombre - Azul,"150,00 €", en 2 tiendas,(5),3.8 de 5 estrellas
Nike Presto Fly Zapatillas - Mujer - Blanco,"69,97 €", de Nike Oficial,(29),4.6 de 5 estrellas
Nike Tanjun Zapatillas - Mujer - Negro,"65,00 €", en 3 tiendas,(2.119),4.8 de 5 estrellas
Nike Free RN Flyknit 2017 Zapatillas de running - Hombre - no ...,"90,97 €", de Nike Oficial,(161),4.1 de 5 estrellas
Nike Air Max Sequent 2 Zapatillas de Running - Hombre,"76,97 €", en 3 tiendas,(22),4.4 de 5 estrellas
Nike Zoom All Out Low Zapatillas de Running - Hombre - Rojo,"97,97 €", de Nike Oficial,(16),3.8 de 5 estrellas
NikeLab Air Humara'17 x Supreme Zapatillas de Running para Trail ...,"170,00 €", de Nike Oficial,0,0
Nike Air Max Sequent 3 Zapatillas de running - Hombre - Azul,"76,97 €", en 2 tiendas,(4),5 de 5 estrellas
Nike Zoom All Out Low 2 Zapatillas de running - Hombre - Gris,"97,97 €", de Nike Oficial,(1),5 de 5 estrellas
Nike Zoom Train Incredibly Fast Zapatillas de entrenamiento ...,"53,97 €", de Nike Oficial,(12),4.8 de 5 estrellas
Nike Air Zoom Structure 20 Zapatillas de running - Hombre - Negro,"83,97 €", en 2 tiendas,(49),4.7 de 5 estrellas
Nike Lunar Control Vapor 2 Zapatillas de Golf - Hombre - Blanco,"180,00 €", en 2 tiendas,(8),4.8 de 5 estrellas
Nike Air Zoom Pegasus 34 Zapatillas de running - Mujer - Negro,"83,97 €", en 2 tiendas,(36),4.5 de 5 estrellas
Nike Free RN 2017 Shield Zapatillas de running - Hombre - Negro,"83,97 €", en 3 tiendas,(1),5 de 5 estrellas
Nike Air Zoom Structure 21 Zapatillas de running - Hombre - Gris,"120,00 €", en más de 5 tiendas,(11),4.4 de 5 estrellas
Nike Air Zoom Pegasus 34 Zapatillas de running - Hombre - Rojo,"120,00 €", en 3 tiendas,(64),4.4 de 5 estrellas
Nike SB Zoom Stefan Janoski Canvas Zapatillas de Skateboard ...,"59,47 €", de Nike Oficial,(64),4.6 de 5 estrellas
Nike Presto Fly Zapatillas - Hombre - Caqui,"69,97 €", de Nike Oficial,(123),4.6 de 5 estrellas
Nike Dualtone Racer SE Zapatillas - Mujer - Marrón,"66,47 €", en 3 tiendas,(9),4.4 de 5 estrellas
Nike Air Zoom Wildhorse 3 Gore-Tex Zapatillas de running - Hombre ...,"130,00 €", de Nike Oficial,(5),2.8 de 5 estrellas
Nike Zoom Fitness Metallic Zapatillas de entrenamiento - Mujer - Negro,"76,97 €", en 3 tiendas,(1),5 de 5 estrellas
Air Jordan Trainer 2 Flyknit Zapatillas de entrenamiento - Hombre ...,"83,97 €", en 2 tiendas,(7),3.8 de 5 estrellas
Nike Air Zoom Vomero 12 Zapatillas de running - Hombre - Azul,"97,97 €", de Nike Oficial,(18),4.7 de 5 estrellas
Nike Air Zoom Vomero 12 Zapatillas de running - Hombre - Naranja,"97,97 €", en 2 tiendas,(18),4.7 de 5 estrellas
Nike Air Zoom Pegasus 34 Shield Zapatillas de running - Hombre - Negro,"130,00 €", en 3 tiendas,(9),4.6 de 5 estrellas
Nike Lunarepic Low Flyknit 2 Zapatillas de Running - Hombre - Morado,"111,97 €", de Nike Oficial,(53),4.2 de 5 estrellas
Nike Air Zoom Pegasus 34 Gem Zapatillas de running - Mujer - Marrón,"120,00 €", en 4 tiendas,(5),5 de 5 estrellas
Nike Air Max Sequent Zapatillas de Running - Mujer - Negro,"69,97 €", de Nike Oficial,(14),4.6 de 5 estrellas
Nike Zoom Fly Zapatillas de running - Hombre - Azul,"150,00 €", en más de 5 tiendas,(84),4.5 de 5 estrellas
Nike Classic Cortez Nylon Zapatillas - Unisex - Gris,"80,00 €", en 2 tiendas,(145),4.6 de 5 estrellas
Nike MD Runner 2 Zapatillas - Mujer - Negro,"65,00 €", en más de 5 tiendas,(87),4.5 de 5 estrellas
